{
  "pages": [
    "pages/native/index",
    "pages/sfc/index",
    "pages/html/index"
  ],
  "subpackages": [
    {
      "root": "subpackages/lab",
      "name": "hmr-lab-sub",
      "pages": [
        "pages/sub-native/index"
      ]
    }
  ],
  "window": {
    "navigationBarTitleText": "HMR_LAB_APP_JSON_MARKER",
    "navigationBarBackgroundColor": "#172554",
    "navigationBarTextStyle": "white",
    "backgroundColor": "#eff6ff"
  },
  "style": "v2",
  "lazyCodeLoading": "requiredComponents"
}
